{
  "bomFormat": "CycloneDX",
  "specVersion": "1.5",
  "version": 1,
  "metadata": {"component": {"type": "library", "name": "llama-index", "version": "0.10.0"}},
  "components": [
    {"type": "library", "name": "llama-index", "version": "0.10.0"},
    {"type": "library", "name": "boto3", "version": "1.34.0"},
    {"type": "library", "name": "anthropic", "version": "0.33.0"},
    {"type": "application", "name": "bedrock:anthropic.claude-v2", "properties": [{"name": "aibom:source", "value": "aws"}]}
  ]
}
